vllm-tuned-configs/gpu1/E=64,N=512,device_name=AMD_Radeon_R9700,dtype=fp8_w8a8,block_shape=[128,128].json
{
    "triton_version": "3.6.0",
    "64": {
        "BLOCK_SIZE_M": 32,
        "BLOCK_SIZE_N": 128,
        "BLOCK_SIZE_K": 256,
        "GROUP_SIZE_M": 4,
        "num_warps": 8,
        "num_stages": 2,
        "waves_per_eu": 4
    },
    "96": {
        "BLOCK_SIZE_M": 32,
        "BLOCK_SIZE_N": 128,
        "BLOCK_SIZE_K": 128,
        "GROUP_SIZE_M": 4,
        "num_warps": 8,
        "num_stages": 2,
        "waves_per_eu": 2
    },
    "128": {
        "BLOCK_SIZE_M": 32,
        "BLOCK_SIZE_N": 128,
        "BLOCK_SIZE_K": 128,
        "GROUP_SIZE_M": 4,
        "num_warps": 8,
        "num_stages": 2,
        "waves_per_eu": 4
    },
    "256": {
        "BLOCK_SIZE_M": 16,
        "BLOCK_SIZE_N": 128,
        "BLOCK_SIZE_K": 128,
        "GROUP_SIZE_M": 4,
        "num_warps": 4,
        "num_stages": 2,
        "waves_per_eu": 2
    }
}
